{
  "schema": "O_PREP_SIGNAL_V1",
  "work_unit": "EXAMPLE-NOT-ACTUAL-ROUTE",
  "node_id": "example",
  "captured_at_utc": "2026-09-25T00:00:00Z",
  "stage": "PUBLISH",
  "router": {
    "status": "NOT_RUN",
    "exit_code": null,
    "local_router_executed": false,
    "policy_hash_verified": false,
    "input_hash_verified": false,
    "output_hash_verified": false,
    "evidence_root_isolated": true
  },
  "evidence": {
    "manifest_verified": true,
    "summary_raw_consistent": false,
    "timestamp_provenance_verified": false,
    "backfill_disclosed": true
  },
  "execution": {
    "secret_exposure": false,
    "mutation_requested": false,
    "authority_verified": false,
    "live_action_requested": false,
    "shared_router_tree_write": false,
    "reviewed_bytes_changed": false,
    "blocked_node_contact": false
  },
  "review": {
    "status": "NOT_RUN",
    "evidence_class": "NOT_RUN",
    "verified_independent": false,
    "harness_separately_verified": false,
    "fresh_context_policy_verified": false,
    "adjudicator_separate": true,
    "review_hash_matches": false,
    "blocking_findings": false
  },
  "delivery": {
    "required": true,
    "state": "PROCESSED",
    "disposition": "HELD",
    "ack_required": true,
    "ack_verified": true,
    "dedup_persistence_verified": false,
    "disposition_evidence_verified": false,
    "claims_accepted": true,
    "idempotency_key": "synthetic-nonce-01"
  },
  "assertions": {
    "metrics_simultaneous_claim": false,
    "claims_backfill_proves_history": false,
    "claims_full_closeout": false
  },
  "metrics": [],
  "open_gates": [
    "REMOTE_FINAL_DISPOSITION_UNVERIFIED",
    "DEDUP_PERSISTENCE_UNVERIFIED"
  ]
}
